adminpack,1.0,false,true,false,pg_catalog,,administrative functions for PostgreSQL
adminpack,1.1,false,true,false,pg_catalog,,administrative functions for PostgreSQL
adminpack,2.0,false,true,false,pg_catalog,,administrative functions for PostgreSQL
amcheck,1.0,false,true,true,,,functions for verifying relation integrity
amcheck,1.1,false,true,true,,,functions for verifying relation integrity
amcheck,1.2,false,true,true,,,functions for verifying relation integrity
autoinc,1.0,false,true,true,,,functions for autoincrementing fields
bloom,1.0,false,true,true,,,bloom access method - signature file based index
btree_gin,1.0,false,true,true,,,support for indexing common datatypes in GIN
btree_gin,1.1,false,true,true,,,support for indexing common datatypes in GIN
btree_gin,1.2,false,true,true,,,support for indexing common datatypes in GIN
btree_gin,1.3,false,true,true,,,support for indexing common datatypes in GIN
btree_gist,1.2,false,true,true,,,support for indexing common datatypes in GiST
btree_gist,1.3,false,true,true,,,support for indexing common datatypes in GiST
btree_gist,1.4,false,true,true,,,support for indexing common datatypes in GiST
btree_gist,1.5,false,true,true,,,support for indexing common datatypes in GiST
citext,1.4,false,true,true,,,data type for case-insensitive character strings
citext,1.5,false,true,true,,,data type for case-insensitive character strings
citext,1.6,false,true,true,,,data type for case-insensitive character strings
cube,1.2,false,true,true,,,data type for multidimensional cubes
cube,1.3,false,true,true,,,data type for multidimensional cubes
cube,1.4,false,true,true,,,data type for multidimensional cubes
dblink,1.2,false,true,true,,,connect to other PostgreSQL databases from within a database
dict_int,1.0,false,true,true,,,text search dictionary template for integers
dict_xsyn,1.0,false,true,true,,,text search dictionary template for extended synonym processing
earthdistance,1.1,false,true,true,,{cube},calculate great-circle distances on the surface of the Earth
file_fdw,1.0,false,true,true,,,foreign-data wrapper for flat file access
fuzzystrmatch,1.1,false,true,true,,,determine similarities and distance between strings
hstore,1.4,false,true,true,,,"data type for storing sets of (key, value) pairs"
hstore,1.5,false,true,true,,,"data type for storing sets of (key, value) pairs"
hstore,1.6,false,true,true,,,"data type for storing sets of (key, value) pairs"
hstore_plperl,1.0,false,true,true,,"{hstore,plperl}",transform between hstore and plperl
hstore_plperlu,1.0,false,true,true,,"{hstore,plperlu}",transform between hstore and plperlu
hstore_plpython2u,1.0,false,true,true,,"{hstore,plpython2u}",transform between hstore and plpython2u
hstore_plpython3u,1.0,false,true,true,,"{hstore,plpython3u}",transform between hstore and plpython3u
hstore_plpythonu,1.0,false,true,true,,"{hstore,plpythonu}",transform between hstore and plpythonu
insert_username,1.0,false,true,true,,,functions for tracking who changed a table
intagg,1.1,false,true,true,,,integer aggregator and enumerator (obsolete)
intarray,1.2,false,true,true,,,"functions, operators, and index support for 1-D arrays of integers"
isn,1.1,false,true,true,,,data types for international product numbering standards
isn,1.2,false,true,true,,,data types for international product numbering standards
jsonb_plperl,1.0,false,true,true,,{plperl},transform between jsonb and plperl
jsonb_plperlu,1.0,false,true,true,,{plperlu},transform between jsonb and plperlu
jsonb_plpython2u,1.0,false,true,true,,{plpython2u},transform between jsonb and plpython2u
jsonb_plpython3u,1.0,false,true,true,,{plpython3u},transform between jsonb and plpython3u
jsonb_plpythonu,1.0,false,true,true,,{plpythonu},transform between jsonb and plpythonu
lo,1.1,false,true,true,,,Large Object maintenance
ltree,1.1,false,true,true,,,data type for hierarchical tree-like structures
ltree_plpython2u,1.0,false,true,true,,"{ltree,plpython2u}",transform between ltree and plpython2u
ltree_plpython3u,1.0,false,true,true,,"{ltree,plpython3u}",transform between ltree and plpython3u
ltree_plpythonu,1.0,false,true,true,,"{ltree,plpythonu}",transform between ltree and plpythonu
moddatetime,1.0,false,true,true,,,functions for tracking last modification time
pageinspect,1.5,false,true,true,,,inspect the contents of database pages at a low level
pageinspect,1.6,false,true,true,,,inspect the contents of database pages at a low level
pageinspect,1.7,false,true,true,,,inspect the contents of database pages at a low level
pgagent,4.0,false,false,false,pgagent,,A PostgreSQL job scheduler
pgcrypto,1.3,false,true,true,,,cryptographic functions
pgrowlocks,1.2,false,true,true,,,show row-level locking information
pgstattuple,1.4,false,true,true,,,show tuple-level statistics
pgstattuple,1.5,false,true,true,,,show tuple-level statistics
pg_buffercache,1.2,false,true,true,,,examine the shared buffer cache
pg_buffercache,1.3,false,true,true,,,examine the shared buffer cache
pg_freespacemap,1.1,false,true,true,,,examine the free space map (FSM)
pg_freespacemap,1.2,false,true,true,,,examine the free space map (FSM)
pg_prewarm,1.1,false,true,true,,,prewarm relation data
pg_prewarm,1.2,false,true,true,,,prewarm relation data
pg_stat_statements,1.4,false,true,true,,,track execution statistics of all SQL statements executed
pg_stat_statements,1.5,false,true,true,,,track execution statistics of all SQL statements executed
pg_stat_statements,1.6,false,true,true,,,track execution statistics of all SQL statements executed
pg_stat_statements,1.7,false,true,true,,,track execution statistics of all SQL statements executed
pg_trgm,1.3,false,true,true,,,text similarity measurement and index searching based on trigrams
pg_trgm,1.4,false,true,true,,,text similarity measurement and index searching based on trigrams
pg_visibility,1.1,false,true,true,,,examine the visibility map (VM) and page-level visibility info
pg_visibility,1.2,false,true,true,,,examine the visibility map (VM) and page-level visibility info
pldbgapi,1.1,false,true,true,,,server-side support for debugging PL/pgSQL functions
plperl,1.0,false,false,false,pg_catalog,,PL/Perl procedural language
plperlu,1.0,false,true,false,pg_catalog,,PL/PerlU untrusted procedural language
plpgsql,1.0,true,false,false,pg_catalog,,PL/pgSQL procedural language
plpython2u,1.0,false,true,false,pg_catalog,,PL/Python2U untrusted procedural language
plpython3u,1.0,false,true,false,pg_catalog,,PL/Python3U untrusted procedural language
plpythonu,1.0,false,true,false,pg_catalog,,PL/PythonU untrusted procedural language
pltcl,1.0,false,false,false,pg_catalog,,PL/Tcl procedural language
pltclu,1.0,false,true,false,pg_catalog,,PL/TclU untrusted procedural language
postgres_fdw,1.0,false,true,true,,,foreign-data wrapper for remote PostgreSQL servers
refint,1.0,false,true,true,,,functions for implementing referential integrity (obsolete)
seg,1.1,false,true,true,,,data type for representing line segments or floating-point intervals
seg,1.2,false,true,true,,,data type for representing line segments or floating-point intervals
seg,1.3,false,true,true,,,data type for representing line segments or floating-point intervals
sslinfo,1.2,false,true,true,,,information about SSL certificates
tablefunc,1.0,false,true,true,,,"functions that manipulate whole tables, including crosstab"
tcn,1.0,false,true,true,,,Triggered change notifications
test_bloomfilter,1.0,false,true,true,,,Test code for Bloom filter library
test_ext1,1.0,false,true,false,test_ext1,"{test_ext2,test_ext4}",Test extension 1
test_ext2,1.0,false,true,true,,"{test_ext3,test_ext5}",Test extension 2
test_ext3,1.0,false,true,true,,,Test extension 3
test_ext4,1.0,false,true,true,,{test_ext5},Test extension 4
test_ext5,1.0,false,true,true,,,Test extension 5
test_ext6,1.0,false,true,false,test_ext6,,test_ext6
test_ext7,1.0,false,true,false,public,,Test extension 7
test_ext7,2.0,false,true,false,public,,Test extension 7
test_ext8,1.0,false,true,false,public,,Test extension 8
test_ext_cyclic1,1.0,false,true,true,,{test_ext_cyclic2},Test extension cyclic 1
test_ext_cyclic2,1.0,false,true,true,,{test_ext_cyclic1},Test extension cyclic 2
test_integerset,1.0,false,true,true,,,Test code for integerset
test_pg_dump,1.0,false,true,true,,,Test pg_dump with an extension
test_predtest,1.0,false,true,true,,,Test code for optimizer/util/predtest.c
test_rbtree,1.0,false,true,true,,,Test code for red-black tree library
tsm_system_rows,1.0,false,true,true,,,TABLESAMPLE method which accepts number of rows as a limit
tsm_system_time,1.0,false,true,true,,,TABLESAMPLE method which accepts time in milliseconds as a limit
unaccent,1.1,false,true,true,,,text search dictionary that removes accents
uuid-ossp,1.1,false,true,true,,,generate universally unique identifiers (UUIDs)
xml2,1.1,false,true,false,,,XPath querying and XSLT
